text,label,TOXICITY,SEVERE_TOXICITY,IDENTITY_ATTACK,INSULT,PROFANITY,THREAT,SEXUALLY_EXPLICIT,OBSCENE,SPAM
" So for example, and just see it from a window and knowing that it's like a couple of miles away and then you're just not allowed to go down and see it",0,0.11528675,0.039841175,0.042894367,0.09193434,0.049892917,0.1418478,0.036662217,0.082900725,0.09302427
 And so because he really wants to help help Palestine um with with good government infrastructure,0,0.07606774,0.02617165,0.11863199,0.0637525,0.04007712,0.039175544,0.041684303,0.019861557,0.23222506
 Doing some things and um there was this giant conference that it was the APAC conference and I didn't know what that was,0,0.059088815,0.020260163,0.032901604,0.026365077,0.042110283,0.044373047,0.09401023,0.72788066,0.25469562
 And when I started hearing what they were saying and it struck me how these people this this a pack group was completely dehumanizing everybody that was in the Palestinian state,0,0.20336515,0.12728621,0.32152304,0.13755645,0.09105807,0.2957547,0.047063675,0.03320288,0.038882285
" And I thought what in the world is going on here and my friends, we were just shocked",0,0.06261763,0.023005376,0.03662795,0.02463788,0.04817006,0.08923423,0.073205344,0.04069324,0.21397425
 And and then I realized also how much power that this group actually has,0,0.049975526,0.015231375,0.020694533,0.020870132,0.025138937,0.05850045,0.04095199,0.034697652,0.13883957
" And they would go around in groups and clusters to to the Congress people's office to get, you know, to ask for this funding at the same time completely dehumanizing everyone saint Palestine",0,0.115994565,0.052029334,0.22286978,0.09758244,0.0388878,0.07878839,0.03620674,0.017879024,0.027376909
" And and then when I, you know, so you fast fast forward years later and my I get to meet my friend Jasim and he's telling me these you know, stories about just how he, you know the trip the trip he had to take to get from from Palestine, he's in Gaza to Estonia to start our you know our school there, I was just absolutely floored and in tears and and so you know when I found out he was there last week and the bombings began, it was it was quite a rush to try to find out if he was okay, but I just wanted to let you guys know that there are people in the US who do understand what's going on and we're speaking up, we're not being silent and and it's hard, I will tell you it's hard because in in places like where I live, I I live in Oklahoma um that are very republican, very conservative and they conflate the, you know supporting of jesus and Christianity with supporting what's going on with with palace with Israel",0,0.16764186,0.14620537,0.33231968,0.14008759,0.08883716,0.26104292,0.09039598,0.11838338,0.37903357
 Can I please respond to that first of all boomer sooner,0,0.14652029,0.08011871,0.09054986,0.07400715,0.11144062,0.19781634,0.24611206,0.017839774,0.45224562
" So Oklahoma is near and dear to my heart, I love it",0,0.09128971,0.056922425,0.07284314,0.049862154,0.08848563,0.19562495,0.1586275,0.0577771,0.24960515
" Um and you know you you brushed on the fact that like yeah, thank you first of all for letting us know like where you stand and and I know I know there are americans that are with us once they find out the truth and that's just the hardest part is to penetrate that brainwashing that they went through",0,0.45554233,0.30002877,0.4302959,0.44897425,0.2791792,0.42344767,0.50464046,0.019640718,0.075600386
 These of these actions by the UN is to continue the reason for the between the conflict,0,0.0861426,0.029321294,0.071872234,0.047374476,0.03519566,0.12082173,0.04273407,0.021775868,0.090783246
" 700,000 Palestinians are expelled which was this was literally you know, other last week",0,0.2824467,0.15535231,0.4906227,0.20246165,0.14215831,0.2246137,0.075449996,0.02189872,0.014821968
" So in my opinion, solving this issue is not by solving the symptoms symptoms",0,0.039942637,0.013545135,0.0307608,0.012439384,0.01587031,0.045786623,0.014630499,0.016410852,0.18238497
" Why? Also mainly because 85% Sorry, excuse me, excuse me, just one second, I'm sorry",0,0.076337494,0.028608218,0.057350084,0.028664675,0.042753633,0.08670442,0.056822337,0.07459023,0.19106902
" Please surrender the microphone when? Okay, Thank you",0,0.031734027,0.012575962,0.021600604,0.012543002,0.013714648,0.06094113,0.023400517,0.10157868,0.0713063
 And I would like to start by saying mo I apologize,0,0.08456476,0.047622494,0.07485909,0.04083335,0.06217875,0.18872629,0.1400436,0.0896261,0.22234723
 Are you gonna be are you gonna again? The format is we want to address the comments and a question that we just made,0,0.07143017,0.016545113,0.030828523,0.05253491,0.01949474,0.03708373,0.030331273,0.08118589,0.7604884
" Is there any perspective you want to share on what I just said? If not we'll reserve, will reserve will come back to you as a speaker in order that we're going please? All right",0,0.06386981,0.023739073,0.029837718,0.036927667,0.027658021,0.08331671,0.047598813,0.03576642,0.6520545
" No need if there is no question to answer or no additional perspective, that's fine",0,0.029995123,0.00813054,0.018882714,0.012637625,0.010240468,0.030664844,0.01340485,0.047039576,0.20065242
 I I can I have something to say in response to them And I also had a question um would it be all right if I said both or do you want me to just respond for now? Go ahead and just respond because I would like to turn it back to Lonnie for for order,0,0.1064063,0.059521962,0.108381055,0.072569385,0.060093667,0.110318094,0.13874997,0.03774411,0.6290076
" Um so growing up, you know, I'm a jewish american, I do have a lot of Israeli family",0,0.24151649,0.19277155,0.46249896,0.16302592,0.137453,0.22970954,0.10185903,0.040810235,0.13360651
" Um and we say every year on Passover for thousands of years, we've said next year in Jerusalem",0,0.07465707,0.039332308,0.13357419,0.03144172,0.0377224,0.13397983,0.03402281,0.1518062,0.10051224
 Um Guy I did see you flash your mic and or come off you,0,0.44118106,0.24486478,0.1122706,0.25652376,0.20327216,0.62973225,0.3181409,0.1657429,0.14990188
" Um was there something you want to say? Who me? Yeah, maybe it was a mistake with not in orders",0,0.086495325,0.030813968,0.051964056,0.05653823,0.03326107,0.09144582,0.0469292,0.03794695,0.020785183
" Yeah, I've got something I gotta say super quick and then let's continue with Monty's PTR",0,0.070822164,0.024569223,0.051719483,0.03907467,0.047762137,0.106295325,0.06328697,0.44941682,0.2269474
" I just wanna say super quick that um the word anti Semitic was invented by a dude named William Maher and like the 18 hundreds, 18 hundreds and um 19 hundreds I should say",0,0.22013752,0.09902523,0.35868126,0.17144637,0.09852453,0.19259168,0.113825284,0.03642045,0.047297966
" Um even if you are a Semitic language speaker, thank you",0,0.17381667,0.12465342,0.28902844,0.16720073,0.09218791,0.1723476,0.09220961,0.2301486,0.042657174
" I would just guys really quickly, I would suggest this rule of thumb",0,0.11669314,0.055065896,0.08109887,0.063591324,0.07549528,0.23546779,0.12720017,0.13996069,0.17575093
" And then when you tweet that come and tell me that you think that you're a semite, I'll accept the whole thing",0,0.31089434,0.15296097,0.4192718,0.31912544,0.17033209,0.10348001,0.120328955,0.16552393,0.013277023
" Please don't make that, argued that false argument about Semitism",0,0.2789071,0.13927749,0.47238258,0.21137136,0.13518532,0.2347326,0.069546536,0.11955237,0.056724582
 I just want to make sure I'm not taking anyone else because I seem to be able to do like a few other people in front of me,0,0.16095608,0.07716529,0.09784399,0.074331105,0.10524294,0.29985765,0.17309372,0.10477873,0.19073111
" But yeah sure I'll go ahead and share, Lonnie Lonnie is taking care of the order so guys don't worry about it because there's there's been some movement on the stage so go ahead, appreciate it",0,0.07990498,0.023026662,0.060473345,0.051199365,0.027600361,0.06950406,0.04721629,0.14850059,0.29212874
 I kind of just had like I mean I agree with George and guy and also Melanie regarding the comment because I am Israeli myself and I was a quick story for myself,0,0.07157486,0.039595056,0.13807365,0.04956046,0.047141757,0.08089622,0.079694815,0.0105293235,0.13235718
 Like people are sharing stories and I've spoken in the room about days ago,0,0.050493866,0.016036913,0.044675376,0.024242897,0.029350013,0.052712448,0.023284184,0.03687775,0.31193486
" Um But the one big thing like for me um like I might be still living in Israel today if if um things in the past when I was born and when my mother and my family lived there um there was war like in the sense that there was bombs being dropped um through the through the time of were um it wasn't Palestine, it was he ran through Saddam Hussein and I'm just saying that in the in the way that um there has been a lot that's gone through Israel throughout the time that you know people feel threatened to stay there and every single time you know um Israel has gone through a some sort of you know war or fight or battle or however someone defines it um we're still there and the thing is a lot of people have were, the funny thing is I've met so many different people around the world from who live in Canada now in the U",0,0.18693268,0.12337028,0.3100644,0.13134079,0.11426177,0.3120764,0.08619849,0.044857714,0.06428501
" Um But but yeah no the quick story, the thing that I wanted to say is throughout the time that you know my mother was in Israel for about five years, I was also born there",0,0.06628627,0.024394944,0.11608445,0.031757902,0.034652796,0.05908677,0.043923836,0.066905394,0.11999024
" Um There was a lot of a lot of disaster, a lot of you know buildings that are no longer there um that have been hit and during this time this was in the early 1990s, um late 1980s and and people who may have been there I was and I was a baby at that time um but you know the it created a lot of like psychological issues for a lot of people and people like my mother, like I haven't been back to Israel since then um because two reasons, but another reason is um the the scarcity that my mother or my family has endured um just being there and I would, you know funny enough I was supposed to go to Israel in in 2020 but of course the pandemic occurred and I didn't travel but I was so excited to head back um and to really explore it and try it, but of course at this moment of time I feel unsafe to go back um And you know I just I want everyone to have the opportunity um Everything from you know from birthright to elia to anything else that's out there",0,0.14859322,0.07413937,0.20195642,0.1301093,0.08522454,0.17423122,0.09390099,0.2363379,0.24718606
" Um You know humanity should be the first thing on everyone's list um causing causing harm to each other is not a thing that I think most people in this room can agree on, we don't want to cause pain, we don't want to cause harm, we want to be peaceful",0,0.12550518,0.08198255,0.11005862,0.05728222,0.088732734,0.37792143,0.07480129,0.03139437,0.19798218
" Be connective can be open, be able to understand both sides and connect with people because everyone has a different perspective, but be able to understand the perspective, educate yourself on their perspective and also give your perspective so that other person can also educate themselves on your perspective",0,0.11512757,0.026690494,0.038286347,0.116740294,0.025884924,0.037175648,0.027616153,0.00930458,0.37839812
" And um I think we all in the end can find a common ground and I think thank you for the opportunity for the time, Thank you all",0,0.05009394,0.020226238,0.039064355,0.023479585,0.023606766,0.09981307,0.035611268,0.06763428,0.17540747
" Um does anyone have a question for DJ or can I move on to the next speaker? Yes, I have a question for D",0,0.053304534,0.01946926,0.033101883,0.020788835,0.023737637,0.052792527,0.057528228,0.09159381,0.34503314
" If it's nice to say wishes, you know, we're coming now out of work and you are saying wishes we have here Those wishes for the last 73 years",0,0.06533431,0.021293193,0.03253282,0.032630164,0.025122188,0.09926644,0.03708457,0.031454608,0.2404725
" If as its peaceful as it was during all of the 16,000 years back, if you keep on guys doing this atrocities, stop doing atrocities, then we will say how we can solve our problem",0,0.14562842,0.082806714,0.12803218,0.10331608,0.091662034,0.2791421,0.09952368,0.1014432,0.08109622
 What's happening now? Everybody is hurting you guys,0,0.18411453,0.07698104,0.08506529,0.12743443,0.083491616,0.49799025,0.05325778,0.30651206,0.13094282
 And there are many people even in Israel who say why do we even accept this money? And then the next thing is keep in mind this also makes up a very very small amount of money that the US spends on defence and also small amount of money that the U,0,0.06327062,0.017727144,0.10198309,0.048409164,0.014937705,0.018083325,0.026418896,0.035254925,0.15416703
 I hope this answers your question and that's just my um meat gives it to me,0,0.24207771,0.12978664,0.09039644,0.129465,0.17508209,0.35785833,0.29566213,0.19810297,0.067291014
 I have a question that I follow up with this butter,0,0.05820665,0.02446878,0.056209393,0.028488256,0.051313832,0.06811276,0.107252605,0.0025774352,0.009474467
" And for that to be kept, we ensure the piece by paying Egypt that money",0,0.06830591,0.023837522,0.14232935,0.037683148,0.021269273,0.05390598,0.024851343,0.022247985,0.158597
 But also there they are a very big part of our social fabric and Americans for the past,0,0.07185134,0.03201795,0.1134167,0.055692777,0.038613375,0.038153313,0.05959858,0.040674392,0.08974266
 Um seven poll 60 of the last 70 years have had a very strong emotional bond with Israel because so many of us personally know people who are Jewish and we feel very strongly about the self determination of the Jewish state because we have such a large constituency with whom we have strong social and cultural ties,0,0.074482,0.028574958,0.14921555,0.038367998,0.03136643,0.04748361,0.06958518,0.013324373,0.11090452
" Including the work week, the idea of a weekend child labor laws, food packing laws to make sure that we have high standards of food",0,0.050188858,0.010909012,0.028586296,0.030733546,0.015904762,0.025672764,0.014744467,0.0233486,0.07452746
" Remember this was father in 1948, just three years after the horrors that the whole world learned about it during the Second World War",0,0.100425206,0.0519555,0.05327229,0.04432523,0.033716843,0.35371205,0.020073755,0.06956453,0.15025237
 Israel is by that time the only real democratic country in the whole of the Middle East,0,0.2880074,0.19283076,0.47964436,0.20126781,0.14935344,0.19150887,0.10377796,0.019333065,0.030181523
" Only democratic country, a small countries are being threatened""}],""items"":[{""start_time"":""0",0,0.11981475,0.065916374,0.17380087,0.09829317,0.072559424,0.2579774,0.066745445,0.101842195,0.075027145
" On a good on a good day of crossing trip takes about six hours, 6 or seven hours",0,0.058946438,0.020248855,0.03761169,0.023986183,0.037120204,0.07021781,0.059413236,0.020173213,0.1439712
" And and and, and it's not just on the Israeli side, right? I mean it's on both sides, but the majority of it, it's that one center checkpoint",0,0.080349594,0.03485762,0.18394862,0.0486852,0.043083802,0.04952668,0.050913744,0.010833155,0.013395034
" We were just almost felt like we were in a prison camp just waiting to get on a freakin bus which at that point you're still waiting and and you know you're melting basically from the heat um to go to the other, stop checkpoint to go and get, you know, interrogate again etcetera",0,0.38549367,0.24256667,0.12152429,0.31656668,0.5055368,0.26535237,0.14593652,0.95555556,0.015300773
" But it is a very humane experience, it is a very painful experience",0,0.09518042,0.04969986,0.060552943,0.034029514,0.083622195,0.24193384,0.1255352,0.022359826,0.36421582
" Just like I can fly into Canada from the US or help, just like you can go from Chicago to michigan and drive without anybody stopping me to say where's your I",0,0.099467546,0.03406605,0.113710284,0.10753425,0.020981692,0.07635189,0.026808122,0.06561514,0.2369529
" Or where is your this or is your that and are you Palestinian or not? So um Anyways, thank you for that alexander Mahmoud, I think we did go to you, I wasn't sure if there was something else that you were going to share",0,0.2203404,0.09902589,0.36219326,0.20733109,0.09707234,0.08576644,0.06376098,0.06614411,0.071224555
 I don't in any way support the continued occupation,0,0.09298414,0.03668155,0.13397524,0.051002957,0.044403754,0.099756666,0.029219197,0.02887457,0.14584465
 I support a two state solution according to the previous peace deals that have been on the table,0,0.052061867,0.022105383,0.04904332,0.021535821,0.03236818,0.06282822,0.06732672,0.02904242,0.5228962
" Um my mother's family from Morocco, my wife's parents are both from Tripoli, from Libya, um a big gala B and I want people just in the audience just be mindful that there is a very western narrative here",0,0.09132784,0.044068415,0.08363478,0.05515286,0.043758012,0.14806058,0.0809039,0.13712668,0.25647873
 Ahmadiyya Muslims can practice their faith freely um within the state of Israel,0,0.16466151,0.09217583,0.38999134,0.113410845,0.06248643,0.07481228,0.031570725,0.04686494,0.017618898
" Um The stories here, we're hearing about checkpoints and uh tourism",0,0.058702804,0.015932478,0.05256136,0.026100866,0.028686088,0.07478373,0.054970454,0.013754987,0.030186897
" My son has never been uh to the West Bank once, I took him to see some Palestinian friends in East Jerusalem",0,0.14310841,0.07636973,0.29370096,0.08765269,0.072527364,0.08145191,0.058404088,0.06874582,0.04007706
" And if you hear people on this platform talking stories about this, it's not",0,0.09650959,0.035999075,0.079418,0.066906735,0.055401936,0.07625301,0.034091037,0.021799434,0.32101515
 And that's I mean I've got a lot to say about I'll let other people speak,0,0.13880342,0.051164597,0.111028016,0.08566664,0.10217896,0.16436404,0.10893965,0.18178418,0.14309567
" Robin, you have to hit your on you buying us here and you go there you go",0,0.2740681,0.12653589,0.07906559,0.11497885,0.07243836,0.7430262,0.05802275,0.07232201,0.106112055
 Um and for the first time in a very long time it feels reassuring to be in a community of people talking about their own experiences and histories and putting stories to faces,0,0.081129886,0.042517874,0.08721925,0.043313198,0.041338217,0.16950792,0.06282833,0.033586666,0.12950172
 Um So I wanted to share a link that is in my profile to an art project by Jr and Margot who are street artists,0,0.117888644,0.049413167,0.056190133,0.09792397,0.08499398,0.1598218,0.056575865,0.06341319,0.61569697
 And they did a large scale project in um basically on the wall built between Israel and Palestine featuring faces of Palestinians next to Israelis,0,0.11869691,0.0924439,0.25244266,0.065834805,0.05033027,0.27209085,0.068698674,0.010398053,0.032510035
" Um and I wanted to share this with the moderators not necessarily share here, but I feel like it's a really important visual uh story of humans and um the fact that when you put two people next to each other with no real description, it's really hard to tell where they're, where they're from, Sometimes it depends on the person obviously, but our stories, I feel like sometimes we're defined by our stories when really we're all human",0,0.06942514,0.033197984,0.06801012,0.032646492,0.038399484,0.102481455,0.042551488,0.038434394,0.59399277
" Um My grandparents Eventually moved to Poland and then Israel, where most of my family lives",0,0.108503245,0.078831576,0.21090296,0.056175914,0.057097513,0.2320186,0.07880634,0.04277623,0.10028457
 I think as an american who just suffered through four years of trump and who continues to be under this Republican party that makes decisions that have nothing to do with my beliefs,0,0.09268741,0.025183188,0.12484432,0.07224032,0.024659714,0.03157009,0.031481206,0.0512428,0.06372965
" Um and the government of Israel is represented in a very small number of people and I was just looking at my passport, someone mentioned, you know, I have a stamp from the first time I went to Israel when I was less than two years old and I have I have vivid memories of going to Israel every few years throughout my entire life um meeting some Palestinian women in France and almost going to Gaza the last time I was in Israel and I didn't get the chance but um I didn't intend to speak today",0,0.17750342,0.10261455,0.34356904,0.11780194,0.08105829,0.21686201,0.1142642,0.08496937,0.06772027
" Um and I just shared this project that jr the face to face project, because I think it's important, um but I'm so thankful because I've been feeling so lost and disheartened by so much of the rhetoric around what's happening um between, you know, humans in um Israel and Palestine, and I've been trying to figure out how to speak out against it and just being here today, like being on here for 12 plus hours, um Hearing stories, I realized like that is what I really and here for right now is to hear stories of people who have been affected by this um the division and the unrest that is really the product of like a few people and it affects the majority",0,0.10012336,0.041339166,0.1464615,0.07580533,0.032713417,0.09455011,0.04515619,0.06184753,0.19671015
" Um and if you go to my profile, you can see the link to this project",0,0.0956212,0.045016304,0.050606072,0.044888467,0.07382291,0.1978435,0.07202386,0.03495605,0.33350825
" Um I want to thank every single person for being here at the moderators, just like, so much respect for what you're doing",0,0.14111474,0.063413955,0.08716341,0.12403082,0.068274654,0.22982095,0.07004263,0.17379542,0.75653
" Um I can't wait to invite more people in and my Israeli, I intend to reach out to my Israeli family",0,0.2520907,0.21265589,0.45368218,0.1217284,0.11999976,0.3876301,0.09923067,0.026497366,0.06812051
" Um and this is also I think a really good opportunity for so many people, like a catalyst for conversation around a really hard subject",0,0.09912166,0.03333102,0.053599667,0.06679673,0.052695036,0.16074863,0.071841665,0.035177577,0.74109936
" Um so thank you for letting me share, I can't believe I actually um um and just like a lot of gratitude for what's happening in this space and check out the JR project",0,0.0614562,0.0152586475,0.038453247,0.04342498,0.018116888,0.050118573,0.023947485,0.02953295,0.8551962
" Um he also has a ted talk, but the uh the project I featured in my profile is specifically Faces of Palestinians next to Israelis, uh farmers next to farmers, twin sisters and brothers and um you know, you can't tell about, you can't tell who's Palestinian and who's in who's Israeli just by looking at that, like we're all human sharing this human experience and thank you for this group because I feel so connected to humanity through it",0,0.16320714,0.11107503,0.30575612,0.12626573,0.105738744,0.2122578,0.11725261,0.012068938,0.19961026
" Um I've been at it for a while, um but before we do that, I just want to say something real quickly",0,0.078586556,0.030422173,0.043618135,0.028238706,0.053705875,0.1655896,0.10352399,0.09189981,0.14423658
" Um so folks, please please please don't always have a ton of people raising their hands",0,0.12196179,0.058977842,0.07546731,0.08901323,0.045936882,0.29666287,0.062349193,0.08244754,0.09628045
" Unfortunately, most of you do not have anything in your profile",0,0.28127015,0.075151116,0.11190916,0.26632297,0.089746945,0.09780412,0.054349348,0.020952353,0.113869645
" Um put something in your profile, connect to social media if you have it",0,0.08530897,0.0305306,0.042997397,0.0618229,0.035661243,0.10223077,0.104794204,0.08476217,0.40222427
" And even more importantly, put on top of your profile a sentence, some statement about what you want to talk about or um or the question that you would like to ask",0,0.08237936,0.02611777,0.03285089,0.05799311,0.025241097,0.06375157,0.044254303,0.010175653,0.04705127
" I just will take the opportunity to mention the startup in Gaza that I was talking about, that had their premises demolished",0,0.18183428,0.1550084,0.18599866,0.107584625,0.12681475,0.5754689,0.14106794,0.07981042,0.19774163
 Mohammed abu matter is a young guy who is the founder and uh some of his friends started this crowdfunding campaign and I put it on my twitter feed and it's the first thing of my profile,0,0.18624407,0.1776925,0.27145568,0.15940712,0.16143772,0.17245206,0.17242996,0.11167653,0.55497044
 I I've been following you guys for for a few days and I have I have uh and I love I love the fact that there is dialogue and I love the fact there's both people speaking up and it's it's really awesome,0,0.057290707,0.02950688,0.044197787,0.028672837,0.055091865,0.083892584,0.13085385,0.041838586,0.6688312
" Nor right, so so reach out if you know how to help or if you want to help and and broaden this",0,0.055338394,0.020214265,0.042598445,0.028024472,0.025692087,0.08622185,0.025165249,0.075491354,0.31577632
 And the last group I got tonight was how fast I was blocked,0,0.16022773,0.06772168,0.12049626,0.10321935,0.11887276,0.17817113,0.09643589,0.05948272,0.36324614
 I can guarantee you there is 3000 reports went in less than one minute nothing happened to the I can guarantee you with him,0,0.08034795,0.029438367,0.03770894,0.059135236,0.03871793,0.07497104,0.04970505,0.09246301,0.21162237
" I just call it whatever you wanna call it, right, right, wrong",0,0.10776698,0.04252519,0.09699859,0.056758087,0.054897353,0.106234044,0.05158809,0.08746929,0.12355333
