text,label,TOXICITY,SEVERE_TOXICITY,IDENTITY_ATTACK,INSULT,PROFANITY,THREAT,SEXUALLY_EXPLICIT,OBSCENE,SPAM
" I don't care at this point, there is no right and there is no wrong because all of the principles has been twisted to a no terminology, right? I get blocked on the spot",0,0.24162148,0.10678393,0.14104794,0.2228689,0.096881986,0.25697315,0.064791426,0.024064422,0.109089434
 So you know what? They do their part and we will do ours peace,0,0.12702739,0.06327759,0.08471769,0.07796214,0.060609017,0.23953116,0.04977288,0.028143562,0.11095352
 I saw how you interacted emotionally in that regard,0,0.1851372,0.06447559,0.11661396,0.1677542,0.09435598,0.09370475,0.06006313,0.026688933,0.08084347
" And yeah, it's difficult for our Palestinian uh, words to be heard, but we have been getting some reach",0,0.16985637,0.092746556,0.38886282,0.11184328,0.11591446,0.120630935,0.14368586,0.03377907,0.021235652
 And this is how we win the war or quote unquote win the war,0,0.13423303,0.055735737,0.072937824,0.052687507,0.06935918,0.33876884,0.05295807,0.050887566,0.2940616
" We are not there, so we can't help them on the ground, but we can educate to help the Israelis",0,0.2407271,0.14531669,0.45033237,0.20317292,0.100585334,0.13931799,0.05969993,0.017031796,0.04840641
 Find out more about what their government is doing to them and two other people of course,0,0.14316066,0.071362235,0.1496109,0.10606291,0.079102725,0.21633558,0.044711754,0.05910757,0.061069693
" And uh, last thing regarding your comment about you being blocked",0,0.3232408,0.08532776,0.11038064,0.26769096,0.083810054,0.17810915,0.04400113,0.007103543,0.033801183
" I think it was the club house rules of disrespecting others and, and uh, and language, I think that's why you probably got locked",0,0.19555655,0.1024609,0.14578903,0.175713,0.09127937,0.37488317,0.0679076,0.0577701,0.10384762
" Uh, yes, emotions take a lot of part in these conversations",0,0.061357494,0.027324414,0.035139978,0.026746567,0.035644017,0.09330714,0.06367659,0.031881053,0.099891976
 I saw you in a different point of view because of the way you attacked whatever that guy's name is instead of trying to educate him,0,0.31089434,0.09282771,0.053979363,0.30148953,0.073086254,0.35245833,0.041681148,0.045522477,0.028722744
" But what I'm saying is the smallest room I opened, it had 200 people in it",0,0.12862042,0.06888908,0.12487492,0.07731153,0.108284675,0.1681417,0.14563517,0.06918999,0.25331476
" Trust me, I know I'm not going back to the clubhouse like an educated and honest",0,0.11025304,0.053401608,0.10131967,0.10068375,0.05504497,0.16115877,0.038682487,0.071025826,0.2461461
 There's nobody that's gonna understand more than me,0,0.113298185,0.047124937,0.07607392,0.057689313,0.080196105,0.15353243,0.07943494,0.037593096,0.054252822
" But if it takes another four years of frustration, but to educate every person we reach is away",0,0.13854294,0.033970263,0.057888012,0.12714674,0.043390043,0.08890347,0.02245486,0.031460937,0.12695237
 That's why my department is not today in the educational one,0,0.06450409,0.019819811,0.047573645,0.033216726,0.034389142,0.06456559,0.034763407,0.06906598,0.5675046
" I didn't mean I was talking to my son, I didn't mean to, I didn't know I was unknown muted, but I did want to ask a question",0,0.02439999,0.008161138,0.013837545,0.0064440044,0.019939031,0.02676602,0.03468217,0.014001842,0.2121649
 So Today after 73 years it's a pretty much impossible to tell Israelis get out right? So my my thoughts are a one state solution,0,0.1595563,0.08809892,0.30264038,0.12719862,0.11211896,0.16612579,0.10330789,0.09076827,0.19397293
 I know that's gonna be impossible but there are certain steps that we could take to get to the end result and to start off by ending the occupation because that's the biggest issue right now is what needs to be done,0,0.10181486,0.06621238,0.08321303,0.031615138,0.04708912,0.5086771,0.0483749,0.02815447,0.11346213
" And I think that ending the occupation has to come in within just like the Blm movement, it came, it came within no other country in the world happened out the U",0,0.15377468,0.100096166,0.17537315,0.112007335,0.08069716,0.32623544,0.16854377,0.04328668,0.10566724
" The Israelis have to acknowledge the occupation and oppression of the Palestinian people and they have to whether it's a revolt against their government or whatnot or do whatever they need to do to end the occupation, That's number one, number two is stop the illegal settlements because that's just increasing the amount of Israelis that are going into that land",0,0.29180014,0.17117436,0.47078225,0.21156193,0.121736065,0.2671898,0.08748329,0.0075526475,0.009614309
 Uh and that's going to create the population issue which is going to create the whole occupation again or the suppression of the Palestinian people and here and I do believe that today We are miles away from where we were 10 years ago or a year ago because of social media and people are becoming more aware of the situation,0,0.13408913,0.07066978,0.25474778,0.07110444,0.06146913,0.23703879,0.036856633,0.010442175,0.097374804
 They can stay there Yet again that this assembly of the Israeli state is on the table,0,0.122348785,0.065409504,0.21620797,0.087919556,0.06757676,0.10548687,0.08603838,0.021123689,0.036419395
 We can use the South african example And how they operated there,0,0.15325047,0.114968345,0.29957244,0.09163134,0.10199003,0.29055408,0.093143836,0.045062065,0.016590936
 It took a little bit of time but it did not take 73 years and it worked,0,0.043632492,0.012103681,0.02720681,0.019499268,0.024021868,0.027499966,0.029496428,0.0328974,0.09739159
" If you use out of too many of our brain out of Palestine and the Ashkenazis, Mizrahi's, all of those, They are different from each other in the eyes of the law within the state",0,0.2698488,0.14668962,0.37996277,0.3049025,0.098420106,0.12835199,0.101623215,0.059935834,0.12750797
" I'm not disagreeing with you, but to joe's point, it's uh P 1914 when we when we said Saddam Hussein is a tyrant, we took him down, right? So may as well, we can take the state their 100% 100%",0,0.30761838,0.087164335,0.08083697,0.35915226,0.09130642,0.15737624,0.08152067,0.068710715,0.04172743
" But to joe's point Pre 1948, jews christians and Muslims lived in harmony altogether",0,0.23472737,0.14928849,0.4729427,0.1494063,0.09766955,0.07338547,0.051983625,0.013007466,0.08921971
" So, so the only thing that changed is it became the state of Israel",0,0.12947896,0.06414898,0.25220588,0.082657754,0.0569798,0.13312262,0.043433655,0.05159385,0.019239686
" So definitely um oppression needs to stop, the one sided war needs to stop and once that happens, I think that will be the biggest catalyst",0,0.15472144,0.08486413,0.11134553,0.1293193,0.065949604,0.39463246,0.07993971,0.061988663,0.09763283
" They're just by stopping this one sided war just by removing the blockades, just by removing the military checkpoints",0,0.2709638,0.1986551,0.21929523,0.16904297,0.098984055,0.712853,0.05574299,0.035396505,0.032684285
 And I think then we can we can maybe like revisit that and go from there,0,0.050143566,0.01871095,0.03057015,0.018469581,0.027663525,0.07904047,0.07087392,0.04412906,0.18038383
 Those people need to pay for the crimes they've done,0,0.35351628,0.20294885,0.30240437,0.23064534,0.102927566,0.52703506,0.05365726,0.114068046,0.10373595
" Sure, but at the end of the day, someone needs to be held accountable accountability is one of the biggest things that's gonna let us get over this and go back as a lot",0,0.08018131,0.03415186,0.062895305,0.055662293,0.05283237,0.13612317,0.093735754,0.0900903,0.051802218
" The muslim state, we never wanted a muslim state in Palestine, it was never called that it can be a land for all because we do respect all religions there",0,0.15114391,0.067420356,0.39074892,0.08393371,0.061157145,0.049986266,0.043224253,0.005595791,0.028683312
" We want to live among everybody there, but it's very hard to forget what's been done to us",0,0.05754725,0.034417268,0.046377104,0.017853035,0.055996954,0.21363308,0.11138266,0.028915005,0.023636622
" But I do think this accountability will at least let us move forward and that I think if I can add, I mean, just you have to look at it this way go, it's like justice has to come first, Liberty has to come next",0,0.06779747,0.0243251,0.054531414,0.040951297,0.036306985,0.07135285,0.08278142,0.04289639,0.07243635
 Um and then peace and reconciliation can come after,0,0.08053424,0.035882,0.063339196,0.044287413,0.041265007,0.13021818,0.062497865,0.032147348,0.1028238
 It's like the one state solution is kind of like removing an oppressive regime and with removing the oppressive regime and the justice comes trying war criminals that have okay,0,0.3492127,0.28081322,0.30313072,0.26956835,0.14050266,0.71132916,0.08838123,0.058629576,0.040930822
 And then we'll so another question is um so let's say we do that,0,0.03357258,0.009607247,0.019538436,0.010904098,0.018887518,0.04287034,0.03297699,0.10110309,0.058850624
" There's a they remove the block, they don't they don't expand, they don't go settle in more territories, they removed the blockades",0,0.12626423,0.08147901,0.1111145,0.07217221,0.07324416,0.45475614,0.08348258,0.045882244,0.045645516
 But then there's the issue of say your ancestors lived in java or tel Aviv and they had houses that were taken from them,0,0.14533937,0.056031745,0.087261625,0.1200243,0.07703295,0.11630943,0.087404415,0.077361204,0.15357992
" Does that all how how does that get? I mean, who owns what with with from a real estate wise people live in Israel or uh in the occupied territories, have a house, they work, they bought at their house and um but then your great great grandfather used to live there",0,0.07199303,0.04270745,0.12103577,0.046982326,0.02570094,0.102549694,0.04713663,0.022608984,0.10271744
" Uh My thoughts are like my grandfather lived there, not my great, great, great great grandfather is just my grandfather",0,0.057310957,0.021976337,0.04191159,0.021677423,0.02697113,0.042265218,0.04490183,0.08000279,0.46923098
" So to be able to get to my point, my father lived there until he was in his early teens",0,0.13556893,0.062297773,0.0775038,0.09118827,0.08455973,0.25793293,0.11651714,0.035003852,0.2508904
" But me personally, I'm not going to go back and ask for a house that somebody lives in because that's just going back to the same cycle and repeating everything since I am doing what exactly",0,0.12079944,0.073450245,0.07468738,0.06144299,0.073425755,0.32611674,0.09412025,0.06413333,0.25063053
" Since I'm the living proof, I can tell you, I have moved on",0,0.055123128,0.017695215,0.031801995,0.022292804,0.034094144,0.08836171,0.076596774,0.071829006,0.53947306
" No, and I think another really important thing, what did he leave that guilt is I don't know, I didn't kick him out",0,0.15726075,0.0755183,0.06269503,0.06913598,0.07763683,0.51973784,0.09774081,0.25615665,0.10547953
" I'm Maria, I'm your moderate Iraqi catholic on the stage",0,0.25489074,0.17609939,0.4277034,0.15861829,0.14037083,0.40491232,0.13194896,0.008930402,0.029027438
 So I would like to speak on that since you brought it up in this room,0,0.08374195,0.035597302,0.05563423,0.053151626,0.05434731,0.13351257,0.11284532,0.0450549,0.13206366
" So we better understand how to have a dialogue in a way that's honoring to to all humans, because I don't think it's ok to for anyone to, you know? Yeah, I just don't think it's ok for for people to leave the space feeling this heart and thinking that this is what we're trying to do with our platform",0,0.084935494,0.031054763,0.06183229,0.051112574,0.04813465,0.06816568,0.022349566,0.102570996,0.44608462
" So guy and and Maria and and Rania, who's who's next? And Ryan is good to see you here",0,0.09420329,0.029961202,0.029537942,0.09530523,0.042120572,0.057233803,0.04230462,0.0628676,0.0657369
 So I've always known that one day we'll be working together on this,0,0.044120044,0.016087467,0.03213258,0.015063997,0.027494851,0.091742456,0.074173875,0.08508777,0.103900805
" I literally we need to Maria, that's why I love you because we both love both people and I think most people here if they didn't come with that love for both people are slowly uh learning to love both their people and the other people",0,0.14970447,0.08617787,0.12765308,0.10213911,0.11732094,0.12594682,0.23808758,0.101620495,0.14086747
 I think that's the key of what we're trying to achieve here,0,0.08405518,0.03333368,0.123271085,0.054398213,0.056505606,0.1280818,0.058296427,0.06668495,0.17978513
 So who was next? Was there please on mute And we are listening however was next I think I was hello everybody,0,0.08806249,0.035636548,0.061041765,0.061624307,0.049546957,0.12727614,0.070952006,0.04290535,0.32348844
 I'm grateful that I can meet Palestinians and jewish people from all over the world and can hear your story,0,0.19757536,0.17168923,0.42075822,0.11338736,0.096476726,0.24058364,0.03349635,0.0074547348,0.0917938
" But what can I say is that I feel so grateful that I have the dollar sight of my, my Romanian uh that can bring me some some objectivity um and some calmness",0,0.22681588,0.1084715,0.16814986,0.111844264,0.24529746,0.18008468,0.18784653,0.19755809,0.49366388
 Even so I emphasize a lot with the Palestinian and also with the two people because every one of them has a reality and I can agree with each one of them,0,0.07475052,0.044164203,0.14604907,0.04177641,0.04575816,0.08725314,0.067674935,0.009172875,0.102637716
 But I think that the politic side of the things um catch up and bring us to this way of putting the story in a line and it's hard for me two to see like a solution,0,0.06564032,0.030313084,0.039537128,0.024897592,0.05702837,0.09490942,0.10514912,0.18032089,0.19759296
" I hope that in my life I will see one and I will be happy to go to my grandfather village from, from Palestine",0,0.10291462,0.09812722,0.21284683,0.045058552,0.057670046,0.3511398,0.12020395,0.047626648,0.22947519
 And also I liked it Uh seeing like the Muslim and the Orthodox people because I'm I was born here in Romania and uh here are more than 80% of the people are orthodox,0,0.1045828,0.043677952,0.29591882,0.06125959,0.048239443,0.05172573,0.061703637,0.031006902,0.07834917
 Uh and I'm open to enter in any uh any any place of God,0,0.08344783,0.045862418,0.12497454,0.035677582,0.08302285,0.07877795,0.075323015,0.06425981,0.04536779
" Uh, I don't know, first energy that brings me peace",0,0.08730691,0.038804818,0.103141114,0.048392504,0.06260893,0.10865244,0.06108253,0.024262037,0.3418132
" And I hope that we we could and I think these kind of discussions even so they are, they're hard because we have emotions and probably I don't have so much than people that are living, I don't know in Gaza or in West Bank because it's hard for me to imagine to not have this that kind of emotion where if I will, I would live there",0,0.14751899,0.08795857,0.099065885,0.08370698,0.08585377,0.3424354,0.08660388,0.016870158,0.1207418
" Um even so, I have a lot of liberties where where do I live? Um I hope that we could be more, I don't know, understandable with each other and accept each other and feel like we are all citizens citizens of the world",0,0.115000255,0.086785845,0.13444906,0.07467391,0.0774105,0.1920012,0.14034009,0.016188696,0.2827031
 I I had Maria call my name out area but I was unable to speak at the time,0,0.11348299,0.057799138,0.06749081,0.066150434,0.111165054,0.124650225,0.20442185,0.045146856,0.13043216
" Uh just once I can excuse me, Mr be a gentleman and let the lady go first",0,0.18215169,0.07195558,0.16790472,0.10726947,0.0983461,0.17834033,0.12370383,0.16090733,0.15972255
" I just wanted to confirm with the mods, but it's okay",0,0.059552506,0.04018707,0.07374375,0.024761155,0.07817012,0.110669054,0.14796698,0.083112136,0.0683923
" Thank you so much for moderating such an inspiring talk between both Israelis and Palestinians, and it's really beautiful to hear everyone's opinions and stories so far",0,0.14177759,0.08118633,0.28427103,0.10947729,0.06262424,0.10280456,0.06319508,0.010812756,0.14438844
" Um following on from what was just spoken about, um I wanted to pose a question to majority of the Israelis within this conversation, um there has been a lot of conversation and sentiment to live in a world where where Palestinians and Israelis are united and that is really beautiful to hear",0,0.15440693,0.11835413,0.2999853,0.10297152,0.060960956,0.16678593,0.09499926,0.035998568,0.14783359
" And it's really hard woman to hear that, you know, firsthand from yourselves with regards to an earlier question that I think in your post as well, about the government's actions with regards to the Israeli government, How is that reflecting these ideals from what you can see so far and in your personal opinion, What on the ground are actions that could be taken in the future to make this realistic and make this dream a reality of of unity? Um what do you think is your opinion and how could this actually genuinely go forward? Thank you so much",0,0.15437397,0.07316621,0.2157123,0.14797628,0.07771387,0.09522696,0.084770925,0.009569667,0.0797861
" Sophia just so you get the precise answers, actions on the ground by the Israeli government",0,0.23063847,0.15516539,0.38286597,0.15941839,0.12628159,0.25944704,0.09513295,0.011412284,0.04232508
" Like what should we be voting for, do you mean or? Yeah, generally as well and general opinions on what could be done going forward? Thank you",0,0.0398335,0.013972848,0.021686621,0.022492377,0.019750021,0.030830573,0.036374733,0.025858706,0.11802915
" Um Yeah, okay, I don't see flashing mix and so I guess I will answer you have to take you guys",0,0.240914,0.1174568,0.13501309,0.12594408,0.12305288,0.5331374,0.13749093,0.1398266,0.13188884
" So yeah, I think I heard Rania's question earlier and I guess you're asking of my opinion on Israel's government's current policies, do I stand behind them? Do I condemn condemn them this kind of a question Before the 2nd part? Sofia",0,0.16862376,0.113679886,0.33257243,0.12551199,0.1079762,0.27964896,0.13754465,0.14193825,0.28965098
" So I I will speak definitely on behalf of my own but also I will suggest that even though obviously I do not represent a majority of voices in Israel, I'm also not singular or alone",0,0.10532957,0.060651444,0.19949952,0.063678786,0.057807855,0.18877782,0.09762093,0.016413296,0.035818
" Uh yeah, I uh sadly uh I want to say happily, but that's really not the right word",0,0.114249155,0.061684474,0.09841273,0.0718577,0.12095882,0.12284043,0.15816708,0.05865919,0.04698949
" Right, So I condemn a lot of Israel's policies when and especially when it comes to the Palestinian issue, also other issues internally other Israeli policies of course and I have stopped giraffe in my profile because I think that that was something that could have been and should have been stopped by the Israeli government and I called for the end of the occupation and I call for equal rights and so all of these things can and should be implemented by the Israeli government and yet they're not and so on these and many other issues, we don't only call them out, but we go out to the streets and and we waved banners and we strike and we do everything we can within the democratic process to bring about that change that we want to see in Israel",0,0.22089407,0.1360387,0.39257824,0.16845903,0.16682184,0.30232552,0.0903104,0.04002506,0.072599605
 American patriots were criticizing that policy and they were doing that not because they hated America but because they loved it and they wanted to see a better America,0,0.24476478,0.12781571,0.40065947,0.20611423,0.13220176,0.10608433,0.0528445,0.04431158,0.011671547
" And so from that, from that point of view, I speak up against uh policies in my country",0,0.1470498,0.06316983,0.15367109,0.08308755,0.08889676,0.081921935,0.13226326,0.034493804,0.066989005
" I'll I guess uh, this conversation is very new to me as a, as a religious jew and as someone who is surrounded by friends and family who are quite right wing",0,0.13616526,0.05872973,0.35369888,0.107080474,0.057164267,0.048850533,0.050676737,0.027182424,0.024255216
" And if I, if I had to place myself on the political spectrum, I would also say that's that's where I stand on a lot of things",0,0.087711535,0.044816084,0.07845031,0.038884256,0.08806596,0.14745893,0.17001238,0.019479949,0.06374973
 So I just want to say thank you to everyone for expressing their opinions,0,0.08393201,0.037640084,0.07205069,0.051392276,0.062486667,0.14616303,0.062027007,0.01450781,0.14099722
 There's a lot of ways of thinking and ways of speaking here that are that are are new to me,0,0.055288848,0.02061005,0.064769074,0.027037097,0.035827763,0.04685969,0.031020997,0.056328274,0.11171734
" Um in terms of supporting the government, I I have to agree with the guy that there there are certain things that the the government is doing that are very problematic and I'll just share for talking about realities on the ground",0,0.111858785,0.04327818,0.08488203,0.12140652,0.062858224,0.1326526,0.074352905,0.07623034,0.20490967
" You know, I have family in incarnation one, which is which is a settlement in the West Bank",0,0.04031601,0.017432468,0.02065345,0.016089853,0.02466761,0.0572721,0.032902457,0.0151933,0.15890247
" So I spent the weekend with them and I took the bus uh to see my family, and for me it was very easy",0,0.059009664,0.03211839,0.0443419,0.021509001,0.03047019,0.17858475,0.06759606,0.02858216,0.0538803
" And they knew that when we reached the checkpoint they got up and they and they left the bus and to me that was extremely frustrating and two to here to see that and to know that they can't just go around like I can and move around like I can't, it's frustrating for me",0,0.057382457,0.018383015,0.042805783,0.028635189,0.03355367,0.051879622,0.03230028,0.036967535,0.021933338
" It's also frustrating that in the last week, because of because of Hamas, I went into a bomb shelter many times and near me in the bomb shelter there were there were babies and little kids whose parents were struggling to explain to them what was going on",0,0.2396663,0.18900329,0.24148406,0.118798055,0.111725084,0.60324913,0.13535301,0.018361596,0.022472762
 And I think it's important to remember that and I want to thank everyone for for their perspectives,0,0.062157188,0.0314572,0.08360236,0.026308937,0.043895584,0.12628384,0.052900888,0.026219489,0.3449946
" Again, loan that was really beautiful and unique because on one hand, you you uh, you voice your fear and express a need to vote for security",0,0.10578379,0.03707667,0.0461672,0.070639946,0.038482744,0.07699183,0.07002843,0.04886339,0.2575239
" I know you're new york, I think somebody is a muted if you don't mind muting",0,0.18115918,0.071615666,0.11425764,0.19011635,0.13812886,0.15171985,0.103610754,0.07125562,0.13284324
" And I suggest that if you spend more time with the salon, some of that fear might dissipate",0,0.07753665,0.031923495,0.048018172,0.04023963,0.036527097,0.13614406,0.06794704,0.23901787,0.09105583
 And you will see that perhaps the human rights and the suffering on the other side Might be more important than 100% sense of security,0,0.10022938,0.04297685,0.07395463,0.065994695,0.039506983,0.18947206,0.026401544,0.0145637775,0.095282674
 So I just want to thank all the mods and I want to thank everyone here,0,0.0930713,0.050937768,0.09266242,0.05405837,0.09078819,0.24518776,0.112714,0.25274688,0.28303778
 We ask you to be respectful to everyone in the room,0,0.12330234,0.04354159,0.0633883,0.119528756,0.07383057,0.11163627,0.05166538,0.035884354,0.1389519
 We are the dictators and that's how we keep it running smoothly,0,0.16386977,0.05635037,0.1267433,0.18669732,0.07036141,0.1642763,0.04432923,0.033432636,0.039279815
" And I'll just remind everybody, this is the room where you meet Palestinians and Israelis who show up with very different perspectives, histories, narratives and visions for the future",0,0.09759161,0.06437581,0.19127998,0.050363753,0.028607134,0.20466906,0.02899757,0.039189514,0.10490798
" People have been waiting for hours to participate in this conversation, but we would also like to focus specifically on Palestinian and Israeli narratives and specifically personal narratives and lived experiences",0,0.11510974,0.07061124,0.20490135,0.08607326,0.06481507,0.12247415,0.067837015,0.003527414,0.067640364
" So who is next in line? We would like to hear from you, please",0,0.08510077,0.030413527,0.033533253,0.065971196,0.03965747,0.075556666,0.035969734,0.016190333,0.12934916
" Uh when I was a kid, um soldiers, Israeli soldiers, it just went at our house a To check like just a random house, there's nothing but me and my uh my brother when I was like 10 or 11 years old and they told us just to go out and uh to the wall and both brought a gun into my head and now I'm not afraid, but I was like thinking um I'm a kid, I'm gonna I'm 10 years old",0,0.33174577,0.2874572,0.415643,0.21200657,0.20494653,0.6063508,0.21859105,0.084144935,0.15420197
 So I think if if if they took in orders for not doing that um it would be good and uh something like we lied to accept that Israel is uh estate is existing,0,0.25062063,0.16752318,0.4226547,0.21804354,0.12826447,0.3150202,0.11913486,0.042434767,0.016779946
" Um That's very heartbreaking to hear, and I also want to say that yeah, b we are scared",0,0.10414717,0.04352962,0.07296446,0.050908666,0.09477867,0.14130187,0.14499263,0.09386903,0.17105715
 You are being drafted to perpetuate this human rights atrocities and as you shouldn't be so levelheaded applique,0,0.3363615,0.14800003,0.12788881,0.3206142,0.15024915,0.2900001,0.057299107,0.18213925,0.03784627
